{"campaign_id":"ca3fc47654e15b3c42a79c6c24a6477952e3a37ac8fc01ee2e8b85ce7d2d5492","campaign_kind":"publication","complete":true,"diagnostic_unqualified_host":false,"publication_valid":true,"reasons":[],"runtime_efficiency":[{"operational_session_timeout_ns":10800000000000,"operational_timeout_exceeded":false,"publication_qualification_gate":true,"session":1,"useful_measurement_ns":4752000000000,"useful_wall_fraction_decimal":"0.5387941801559049555230298254738176467456","wall_ns":8819694374993},{"operational_session_timeout_ns":10800000000000,"operational_timeout_exceeded":false,"publication_qualification_gate":true,"session":2,"useful_measurement_ns":4752000000000,"useful_wall_fraction_decimal":"0.5403875235477597896420703099781678670259","wall_ns":8793689330209}],"schema_version":"quicperf.analysis.v2.3","watermark":null}